Nongshim,Champong Noodle Soup Spicy Seafood Flavor,Pack,South Korea,5,Republic of Korea,"3,590","3,650","3,830","3,740","3,820"
Oni Hot Pot,Seaweed Flavour Noodle,Pack,Taiwan,2,Taiwan,710,680,770,820,830
Doll,Instant Noodle Preserved Vegetable Flavour,Pack,China/Hong Kong,4,China/Hong Kong,"44,400","40,430","38,520","38,970","40,250"
MyKuali,Penang Hokkien Prawn Noodle Authentic Taste,Cup,Malaysia,5,Malaysia,"1,340","1,370","1,390","1,310","1,370"
Nissin,Nupasta Salmon In White Sauce Flavour Instant Noodle,Pack,China/Hong Kong,5,China/Hong Kong,"44,400","40,430","38,520","38,970","40,250"
Nissin,Big Cup Noodles Seafood Curry Flavour,Cup,China/Hong Kong,5,China/Hong Kong,"44,400","40,430","38,520","38,970","40,250"
Nissin,Demae Iccho Beef Flavour Instant Noodle,Bowl,China/Hong Kong,4,China/Hong Kong,"44,400","40,430","38,520","38,970","40,250"
Nissin,Mie Goreng Indonesia Stir Noodle Original Flavour,Pack,China/Hong Kong,4,China/Hong Kong,"44,400","40,430","38,520","38,970","40,250"
Nissin,Demae Ramen Sesame Flavour Instant Noodles,Pack,China/Hong Kong,5,China/Hong Kong,"44,400","40,430","38,520","38,970","40,250"
Fuku,Superior Soup Instant Rice Vermicelli,Bowl,China/Hong Kong,5,China/Hong Kong,"44,400","40,430","38,520","38,970","40,250"
Nissin,Demae Ramen Straight Noodle Kyushu Tonkotsu Instant Noodle,Pack,China/Hong Kong,5,China/Hong Kong,"44,400","40,430","38,520","38,970","40,250"
Nissin,Taisho Fried Noodle Sesame Paste Flavour Instant Noodle,Pack,China/Hong Kong,5,China/Hong Kong,"44,400","40,430","38,520","38,970","40,250"
Nissin,Cup Noodles Pork Chowder Flavour,Cup,China/Hong Kong,4,China/Hong Kong,"44,400","40,430","38,520","38,970","40,250"
Nissin,Cup Mifun Spicy Beef Flavour,Cup,China/Hong Kong,4,China/Hong Kong,"44,400","40,430","38,520","38,970","40,250"
Fuku,Non-Fried Superior Soup Noodle,Pack,China/Hong Kong,4,China/Hong Kong,"44,400","40,430","38,520","38,970","40,250"
Nissin,Nupasta Carbonara Flavour Instant Noodle,Cup,China/Hong Kong,5,China/Hong Kong,"44,400","40,430","38,520","38,970","40,250"
Nissin,Demae Iccho Curry Beef Flavour,Cup,China/Hong Kong,4,China/Hong Kong,"44,400","40,430","38,520","38,970","40,250"
Nissin,Cup Noodles Big Spicy Seafood Flavour,Cup,China/Hong Kong,5,China/Hong Kong,"44,400","40,430","38,520","38,970","40,250"
Nissin,Demae Iccho Black Garlic Oil Tonkotsu,Bowl,China/Hong Kong,3.75,China/Hong Kong,"44,400","40,430","38,520","38,970","40,250"
Mi Sedaap,Mi Segera Mi Goreng Ayam Krispi,Pack,Indonesia,4.5,Indonesia,"13,430","13,200","13,010","12,620","12,540"
Nissin,Cup Noodles Sabor Pollo Habanero Y Limon Sopa Instantanea,Cup,Mexico,3.5,Mexico,900,850,890,960,"1,180"
Great Value,Spicy Ramen Noodles,Pack,Canada,4,Canada,190,190,190,190,190
Maruchan,Bowl Taste Of Asia Beef Flavor Sukiyaki Ramen,Bowl,United States,5,USA,"4,280","4,080","4,100","4,130","4,400"
A-Sha Dry Noodle,Tainan Noodle Original Sauce,Pack,Taiwan,5,Taiwan,710,680,770,820,830
Tokushima Seifun,Negi Ramen,Bowl,Japan,1.75,Japan,"5,500","5,540","5,660","5,660","5,780"
Doll,Instant Noodle Vegetarian Flavour,Pack,China/Hong Kong,3.75,China/Hong Kong,"44,400","40,430","38,520","38,970","40,250"
Maggi,Fusian Special Edition Ow... Ow... Spicy Cow Mi Goreng,Pack,Australia,5,Australia,360,370,380,390,410
Samyang Foods,Fresh Jjajang,Pack,South Korea,4.5,Republic of Korea,"3,590","3,650","3,830","3,740","3,820"
Marutai,Hakata Tonkotsu Ramen,Pack,Japan,5,Japan,"5,500","5,540","5,660","5,660","5,780"
Four Seas,Kung Tak Lam Vegetarian Noodle (Mushroom),Pack,China/Hong Kong,3,China/Hong Kong,"44,400","40,430","38,520","38,970","40,250"
Nongshim,Arrabiata Rice Bucatini,Pack,United States,5,USA,"4,280","4,080","4,100","4,130","4,400"
Mamee,Pepper Noodles Vegetarian,Pack,China/Hong Kong,3.25,China/Hong Kong,"44,400","40,430","38,520","38,970","40,250"
Ottogi,Ramyon Sabor Mariscos,Pack,Mexico,3.75,Mexico,900,850,890,960,"1,180"
Kamfen,Dried Mix Noodles Scallop Seafood Flavoured,Tray,China/Hong Kong,4.25,China/Hong Kong,"44,400","40,430","38,520","38,970","40,250"
Nissin,Cup Noodle Light+ Cheese Fondue,Cup,Japan,5,Japan,"5,500","5,540","5,660","5,660","5,780"
Four Seas,Beef And Radish Flavour Instant Noodle,Pack,China/Hong Kong,2.5,China/Hong Kong,"44,400","40,430","38,520","38,970","40,250"
Zow Zow,Instant Noodle Shrimp Tom Yam Flavoured,Pack,Thailand,3.75,Thailand,"3,070","3,070","3,360","3,390","3,460"
Nissin,RapiFideo Sabor A Chile Y Limon,Cup,Mexico,3.75,Mexico,900,850,890,960,"1,180"
Koyo,Garlic Pepper Reduced Sodium Ramen,Pack,United States,0,USA,"4,280","4,080","4,100","4,130","4,400"
Nissin,Tokyo Tokunou Gyokai Tonkotsu,Bowl,Japan,5,Japan,"5,500","5,540","5,660","5,660","5,780"
Suimin,Noodles Curried Prawn Flavour,Cup,Australia,3.25,Australia,360,370,380,390,410
Maruchan,Instant Lunch Sriracha Chicken Flavor Ramen Noodle Soup,Cup,United States,3.75,USA,"4,280","4,080","4,100","4,130","4,400"
Indomie,Pop Mie Mi Instan Cup Rasa Ayam,Cup,Indonesia,3.5,Indonesia,"13,430","13,200","13,010","12,620","12,540"
Master Kong,Artificial Pork Ribs Flavour Instant Noodle,Pack,China/Hong Kong,3.50,China/Hong Kong,"44,400","40,430","38,520","38,970","40,250"
MyKuali,Penang Red Tom Yum Goong Noodle Authentic Taste,Cup,Malaysia,5.00,Malaysia,"1,340","1,370","1,390","1,310","1,370"
Ottogi,Ramyon Sabor A Res,Pack,Mexico,4,Mexico,900,850,890,960,"1,180"
Acecook,Kadomen Koikoku Tonkotsu,Bowl,Japan,3.8,Japan,"5,500","5,540","5,660","5,660","5,780"
Oni Hot Pot,XO Sauce Noodle,Pack,Taiwan,5,Taiwan,710,680,770,820,830
E-Zee,Perisa Asam Pedas Mi Segera,Pack,Malaysia,4,Malaysia,"1,340","1,370","1,390","1,310","1,370"
Great Value,Chicken Style Ramen Noodles,Pack,Canada,3.5,Canada,190,190,190,190,190
Doll,Hello Kitty Dim Sum Noodle Japanese Soy Sauce Flavour,Cup,China/Hong Kong,3.0,China/Hong Kong,"44,400","40,430","38,520","38,970","40,250"
ORee Garden,Malaysia Green Curry Noodle,Bowl,Malaysia,5.0,Malaysia,"1,340","1,370","1,390","1,310","1,370"
Suimin,Noodles Mi Goreng,Cup,Australia,4.3,Australia,360,370,380,390,410
Master Kong,Tomato Sauce Instant Noodle,Pack,China/Hong Kong,4.50,China/Hong Kong,"44,400","40,430","38,520","38,970","40,250"
Nissin,Cup Noodles Sabor Franhp Com Requeijao,Cup,Brazil,5,Brazil,"2,370","2,370","2,350","2,230","2,370"
Tokushima Seifun,Yakibuta Ramen,Bowl,Japan,5,Japan,"5,500","5,540","5,660","5,660","5,780"
A1,Vegetarian Herbal Noodle,Pack,Malaysia,1.5,Malaysia,"1,340","1,370","1,390","1,310","1,370"
Migawon,Hovenia Ramen Vegetable Flavor,Pack,South Korea,3.5,Republic of Korea,"3,590","3,650","3,830","3,740","3,820"
A-Sha Dry Noodle,Hakka BBQ Sauce Noodle,Pack,Taiwan,4.25,Taiwan,710,680,770,820,830
Acecook,Maru Uma Curry Udon,Cup,Japan,3.5,Japan,"5,500","5,540","5,660","5,660","5,780"
Fantastic,Noodles Oriental Flavour,Cup,Australia,3.25,Australia,360,370,380,390,410
Chaudhary's Wai Wai,Instant Noodles Artificial Chicken & Shrimp Flavored,Pack,India,2.5,India,"5,340","3,260","4,270","5,420","6,060"
Kamfen,Noodle King Artificial Beef Soup Flavored,Bowl,China/Hong Kong,3.75,China/Hong Kong,"44,400","40,430","38,520","38,970","40,250"
CarJEN,Otentiq Cheezy Curry Instant Noodles (Improved Taste),Pack,Malaysia,5,Malaysia,"1,340","1,370","1,390","1,310","1,370"
Myojo,Charumera Atyificial Tonkotsu Shouyu Flavor,Pack,Japan,3.75,Japan,"5,500","5,540","5,660","5,660","5,780"
Singa-Me,Instant Noodles Beef Flavour,Cup,Australia,2,Australia,360,370,380,390,410
Maruchan,"Sopa Maruchan Sabor a Camaron, Limon y Habanero",Pack,Mexico,3.5,Mexico,900,850,890,960,"1,180"
Nissin,Shinshu Miso Ramen,Bowl,Japan,5,Japan,"5,500","5,540","5,660","5,660","5,780"
MyKuali,Penang White Curry Authentic Taste Cup,Cup,Malaysia,4.75,Malaysia,"1,340","1,370","1,390","1,310","1,370"
Urban Noodle,Authentic Street Food Chow Mein,Cup,United Kingdom,2,UK,360,360,360,360,370
Urban Noodle,Authentic Street Food Pad Thai,Cup,United Kingdom,2.5,UK,360,360,360,360,370
Urban Noodle,Authentic Street Food Black Bean,Cup,United Kingdom,0,UK,360,360,360,360,370
Urban Noodle,Authentic Street Food Thai Red Curry,Cup,United Kingdom,3,UK,360,360,360,360,370
Urban Noodle,Authentic Street Food Satay,Cup,United Kingdom,5,UK,360,360,360,360,370
Kang Shi Fu,Artificial Roasted Beef,Pack,China/Hong Kong,3.5,China/Hong Kong,"44,400","40,430","38,520","38,970","40,250"
Acecook,Seabura Tonkotsu Ramen,Cup,Japan,3.75,Japan,"5,500","5,540","5,660","5,660","5,780"
Pulmuone,Noodle With Spicy Oyster Soup,Pack,South Korea,4,Republic of Korea,"3,590","3,650","3,830","3,740","3,820"
Samyang Foods,Honey & Cheese Big Bowl,Bowl,South Korea,0,Republic of Korea,"3,590","3,650","3,830","3,740","3,820"
Great Value,Chicken Style Noodles With Vegetables,Cup,Canada,3.5,Canada,190,190,190,190,190
E-Zee,Perisa Kari Mi Segera (Improved Taste),Pack,Malaysia,5,Malaysia,"1,340","1,370","1,390","1,310","1,370"
Oni Hot Pot,Ghost Pepper Noodle,Pack,Taiwan,4.5,Taiwan,710,680,770,820,830
Great Value,Beef Style Ramen Noodles,Pack,Canada,3.5,Canada,190,190,190,190,190
MAMA,Vegetarian Instant Noodles Shiitake Flavour,Pack,Thailand,2,Thailand,"3,070","3,070","3,360","3,390","3,460"
Trident,2 Minute Laksa Flavour Noodles,Pack,Australia,2,Australia,360,370,380,390,410
MAMA,Rangers Snack Noodles Popcorn Flavour,Pack,Myanmar,3.75,Myanmar,410,460,570,590,600
Conimex,Oriental Noodles Soto Ajam,Cup,Netherlands,3,Netherlands,20,20,20,30,20
Sichuan Baijia,Hot spicy Flavor Instant Vermicelli,Bowl,China/Hong Kong,3.5,China/Hong Kong,"44,400","40,430","38,520","38,970","40,250"
Nongshim,Rice Fettucini Alfredo,Pack,United States,3.75,USA,"4,280","4,080","4,100","4,130","4,400"
Kamfen,Wonton Noodles Beef Flavour,Bowl,China/Hong Kong,3.75,China/Hong Kong,"44,400","40,430","38,520","38,970","40,250"
A-Sha Dry Noodle,Hakka Spicy Barbeque Sauce,Pack,Taiwan,4.50,Taiwan,710,680,770,820,830
Nissin,Donbei Dashi Shoyu Yakiudon,Bowl,Japan,3.75,Japan,"5,500","5,540","5,660","5,660","5,780"
Nissin,Raoh Rich Miso Flavor,Bowl,Japan,5,Japan,"5,500","5,540","5,660","5,660","5,780"
Nissin,Cup Noodles Tom Yum Goong,Cup,Japan,3.8,Japan,"5,500","5,540","5,660","5,660","5,780"
Nissin,Cup Noodle Big Seafood Clam Chowder,Cup,Japan,4,Japan,"5,500","5,540","5,660","5,660","5,780"
Nissin,Chikin Ramen Donburi,Bowl,Japan,5,Japan,"5,500","5,540","5,660","5,660","5,780"
Nissin,Curry Udon,Cup,Japan,5.0,Japan,"5,500","5,540","5,660","5,660","5,780"
Nissin,Men Shokunin Shoyu,Bowl,Japan,5.0,Japan,"5,500","5,540","5,660","5,660","5,780"
Nissin,Cup Noodle Vegeta Buta-kyabetsu Tonkotsu,Cup,Japan,4.3,Japan,"5,500","5,540","5,660","5,660","5,780"
Nissin,Cup Noodle Pasta Style Tarako Spaghetti,Cup,Japan,4.0,Japan,"5,500","5,540","5,660","5,660","5,780"
Nissin,Cup Noodle Big Cheese Mexican Chilli,Cup,Japan,5.00,Japan,"5,500","5,540","5,660","5,660","5,780"
Nissin,Gyoretsu-no-Dekiru-Mise-no-Ramen (Shrimp Tantanmen),Bowl,Japan,5,Japan,"5,500","5,540","5,660","5,660","5,780"
Nissin,Raoh Tonkotsu,Pack,Japan,5,Japan,"5,500","5,540","5,660","5,660","5,780"
Nissin,Cup Noodle Light Plus Ratatouille,Cup,Japan,4.5,Japan,"5,500","5,540","5,660","5,660","5,780"
Nissin,Cup Noodle Milk Chikin Ramen,Cup,Japan,5,Japan,"5,500","5,540","5,660","5,660","5,780"
Nissin,Cup Noodle,Cup,Japan,5.0,Japan,"5,500","5,540","5,660","5,660","5,780"
MyKuali,Penang White curry Noodle Authentic Taste,Pack,Malaysia,5.00,Malaysia,"1,340","1,370","1,390","1,310","1,370"
MAMA,Instant Noodles Chicken Soup Flavour,Pack,Myanmar,3.50,Myanmar,410,460,570,590,600
Nissin,Yokohama Walker Iekei Ramen,Bowl,Japan,4.50,Japan,"5,500","5,540","5,660","5,660","5,780"
A-Sha Dry Noodle,Quinoa Noodle With Oyster Sauce And Vegetables,Pack,Taiwan,4.25,Taiwan,710,680,770,820,830
Prima Taste,Singapore Prawn Soup La Mian,Pack,Singapore,5,Singapore,130,130,130,130,130
Nissin,Chinese Tan Tan Vermicelli,Cup,China/Hong Kong,5.0,China/Hong Kong,"44,400","40,430","38,520","38,970","40,250"
Tokushima Seifun,Tokushima Ramen,Pack,Japan,4,Japan,"5,500","5,540","5,660","5,660","5,780"
Master Kong,Assorted Pork Bone Noodle,Pack,China/Hong Kong,4,China/Hong Kong,"44,400","40,430","38,520","38,970","40,250"
MyKuali,Penang Red tom Yum Goong Noodle Authentic Taste,Pack,Malaysia,5.0,Malaysia,"1,340","1,370","1,390","1,310","1,370"
Suimin,Noodles Witrh Prawn & Chicken Flavour,Cup,Australia,3.5,Australia,360,370,380,390,410
Nissin,BIG Cup Noodle Ajillo,Cup,Japan,3.0,Japan,"5,500","5,540","5,660","5,660","5,780"
CarJEN,Nyonya Curry Laksa (Improved Taste),Pack,Malaysia,5.0,Malaysia,"1,340","1,370","1,390","1,310","1,370"
MyOri,Malaysia Penang Green Curry Vermicelli (New Package),Pack,Malaysia,5.00,Malaysia,"1,340","1,370","1,390","1,310","1,370"
Itsuki,Kumamoto Spicy Ramen,Pack,Japan,4.25,Japan,"5,500","5,540","5,660","5,660","5,780"
Nissin,Soba Fried Noodles Classic,Pack,Germany,3.25,Germany,180,190,200,200,200
Samyang Foods,Cheese Curry Ramyun,Pack,South Korea,5,Republic of Korea,"3,590","3,650","3,830","3,740","3,820"
Nissin,Cup Noodles Sabor Calabresa,Pack,Brazil,4.25,Brazil,"2,370","2,370","2,350","2,230","2,370"
Doll,Spicy Flavour Instant Mifun,Pack,China/Hong Kong,2.75,China/Hong Kong,"44,400","40,430","38,520","38,970","40,250"
Fujiwara,Horse Crab Flavour Ramen,Pack,Japan,3.5,Japan,"5,500","5,540","5,660","5,660","5,780"
MyOri,Malaysia Penang Red Curry Noodle,Pack,Malaysia,5,Malaysia,"1,340","1,370","1,390","1,310","1,370"
Nongshim,Noodle Soup Seasoned With Real Kimchi,Pack,United States,4.75,USA,"4,280","4,080","4,100","4,130","4,400"
Nissin,Top Ramen Chicken Flavor Ramen Noodle Soup (New Packaging),Pack,United States,3.5,USA,"4,280","4,080","4,100","4,130","4,400"
Tokushima Seifun,Kinchan Ramen,Pack,Japan,4.5,Japan,"5,500","5,540","5,660","5,660","5,780"
Wei Lih,GGE Noodle Snack Wheat Crackers Soy Sauce Ramen,Pack,Taiwan,3.75,Taiwan,710,680,770,820,830
MyKuali,Penang Spicy Prawn Soup Noodle Authentic Taste,Pack,Malaysia,5,Malaysia,"1,340","1,370","1,390","1,310","1,370"
MAMA,Instant Noodles Coconut Milk Flavour,Pack,Myanmar,5,Myanmar,410,460,570,590,600
Kabuto Noodles,Rice Noodles Vegetable Laksa,Cup,United Kingdom,3.75,UK,360,360,360,360,370
Kabuto Noodles,Rice Noodles Chicken Pho,Cup,United Kingdom,3.5,UK,360,360,360,360,370
Kabuto Noodles,Chicken Ramen,Cup,United Kingdom,4.25,UK,360,360,360,360,370
Kabuto Noodles,Chilli Chicken Ramen,Cup,United Kingdom,4,UK,360,360,360,360,370
Myojo,Charumera Shoyu Ramen,Pack,Japan,4,Japan,"5,500","5,540","5,660","5,660","5,780"
IbuRamen,Mi Goreng Bento Noodles In A Box Curry Masala Flavour,Tray,United States,4,USA,"4,280","4,080","4,100","4,130","4,400"
MAMA,Cup Vegetarian Instant Noodles Tom Yum Flavour,Cup,Thailand,4,Thailand,"3,070","3,070","3,360","3,390","3,460"
Maruchan,Spicy Tomato Salsa Ramen,Cup,Japan,0,Japan,"5,500","5,540","5,660","5,660","5,780"
Nissin,Raoh Ramen Noodle Soup Umami Soy Sauce Flavor,Pack,United States,4.75,USA,"4,280","4,080","4,100","4,130","4,400"
Koh Thai,Island Of Flavours Spicy Thai Chicken Instant Noodles Soup,Pack,Netherlands,2,Netherlands,20,20,20,30,20
Prima Taste,Singapore Fish Soup La Mian,Pack,Singapore,5,Singapore,130,130,130,130,130
Ve Wong,Kung-Fu Brand Instant Oriental Noodle Soup Artificial Beef Flavor,Pack,Taiwan,3.75,Taiwan,710,680,770,820,830
Nissin,Cup Noodles Ramen Noodle Soup Hearty Chicken Flavor [New Package],Cup,United States,4.25,USA,"4,280","4,080","4,100","4,130","4,400"
Fujiwara,Red King Crab Flavour Ramen,Pack,Japan,4,Japan,"5,500","5,540","5,660","5,660","5,780"
Bamee,Oriental Style Instant Noodles Shrimp Flavour (Tom Yum),Pack,Thailand,3.5,Thailand,"3,070","3,070","3,360","3,390","3,460"
Sichuan Baijia,Artificial Pickled Cabbage Fish Flavor Instant Vermicelli,Pack,China/Hong Kong,1.5,China/Hong Kong,"44,400","40,430","38,520","38,970","40,250"
Prima Taste,Singapore Laksa Wholegrain La Mian,Pack,Singapore,5,Singapore,130,130,130,130,130
Nissin,Raoh Shio Ramen,Pack,Japan,4.75,Japan,"5,500","5,540","5,660","5,660","5,780"
MAMA,Oriental Style Instant Noodles Masala Flavour,Pack,Bangladesh,3.5,Bangladesh,250,270,290,350,310
Wei Lih,GGE Noodle Snack Wheat Crackers Hot Spicy,Pack,Taiwan,5,Taiwan,710,680,770,820,830
New Touch,Sugomen Niigata Seabura Shoyu Ramen,Bowl,Japan,5,Japan,"5,500","5,540","5,660","5,660","5,780"
Ibumie,Always Mi Goreng Perisa Sambal Udang,Pack,Malaysia,3.5,Malaysia,"1,340","1,370","1,390","1,310","1,370"
Unox,Good Noodles Tandoori,Pack,Netherlands,2.5,Netherlands,20,20,20,30,20
Nissin,Cup Noodle Pasta Style Bolognese,Cup,Japan,5,Japan,"5,500","5,540","5,660","5,660","5,780"
MAMA,Instant Noodles Shrimp Creamy Tom Yum Flavour,Pack,Myanmar,5,Myanmar,410,460,570,590,600
Nissin,Donbei Kamodashi Soba,Bowl,Japan,5,Japan,"5,500","5,540","5,660","5,660","5,780"
MAMA,Chicken Soup Flavour Cup Noodles,Cup,Myanmar,3.75,Myanmar,410,460,570,590,600
Fortune,Rice Noodle Coconut Curry,Pack,United States,1,USA,"4,280","4,080","4,100","4,130","4,400"
Love Cook,Guanmiao Dried Noodles With Oleum Sesami,Pack,Taiwan,3.75,Taiwan,710,680,770,820,830
Love Cook,Guanmiao Dried Noodles With Spicy Sauce,Pack,Taiwan,5,Taiwan,710,680,770,820,830
Love Cook,Guanmiao Dried Noodles With Authentic Sauce,Pack,Taiwan,4.5,Taiwan,710,680,770,820,830
Love Cook,Guanmiao Dried Noodles With Shallot Flavor,Pack,Taiwan,3.75,Taiwan,710,680,770,820,830
Bonasia,Instant Noodles chicken Flavour,Pack,Hungary,3.75,Hungary,20,20,30,30,30
Koh Thai,Island Of Flavours Lemongrass Instant Noodles Soup,Pack,Netherlands,0.25,Netherlands,20,20,20,30,20
MAMA,Instant Noodles Minced Pork Flavour,Pack,Cambodia,3.50,Cambodia,250,270,280,330,330
Bamee,Instant Noodles Oriental Style Chicken Flavour,Pack,Thailand,3,Thailand,"3,070","3,070","3,360","3,390","3,460"
Marutai,Kogashi Megiiri Tonkotsu Kagoshima Ramen,Bowl,Japan,3.5,Japan,"5,500","5,540","5,660","5,660","5,780"
Nissin,Bowl Noodles Hot & Spicy Chicken Flavor Less Sodium Ramen Noodle Soup,Bowl,United States,4,USA,"4,280","4,080","4,100","4,130","4,400"
Prima,Juzz's Mee Creamy Chicken Flavour,Pack,Singapore,5,Singapore,130,130,130,130,130
Sichuan Baijia,Broad Noodle Artificial Beef Flavor,Pack,China/Hong Kong,3.5,China/Hong Kong,"44,400","40,430","38,520","38,970","40,250"
Conimex,Oriental Noodles Teriyaki,Cup,Netherlands,0.5,Netherlands,20,20,20,30,20
Mie Sedaap,Instant Cup Mi Kuah Rasa Baso Spesial,Cup,Indonesia,1.5,Indonesia,"13,430","13,200","13,010","12,620","12,540"
Nissin,Cup Noodles Ramen Noodle Soup Chicken Flavor [New Package],Cup,United States,3.5,USA,"4,280","4,080","4,100","4,130","4,400"
Itsuki,Ramen Tonkotudou Kumamoto Noodles,Pack,Japan,0.75,Japan,"5,500","5,540","5,660","5,660","5,780"
Maruchan,Shiroi Chikara Mochi Udon,Bowl,Japan,4.5,Japan,"5,500","5,540","5,660","5,660","5,780"
iMee,Instant Noodles chicken Flavour,Pack,Netherlands,3.5,Netherlands,20,20,20,30,20
IbuRamen,Mi Goreng Bento Noodles In A Box Hot Sweet & Sour Flavor,Tray,United States,0.25,USA,"4,280","4,080","4,100","4,130","4,400"
Nissin,Soba Fried Noodles Teriyaki,Pack,Germany,3,Germany,180,190,200,200,200
Itsuki,Yuzu Sesame Sauce Udon,Bowl,Japan,4.5,Japan,"5,500","5,540","5,660","5,660","5,780"
Prima,Juzz's Mee Curry Flavour,Pack,Singapore,5,Singapore,130,130,130,130,130
Thai Smile,Mushroom Rice Noodle Soup Bowl,Bowl,United States,0,USA,"4,280","4,080","4,100","4,130","4,400"
MAMA,Instant Noodles Chicken Sichek Flavour,Pack,Myanmar,3.75,Myanmar,410,460,570,590,600
Nissin,Emergency Chikin Ramen Cup Noodle,Cup,Japan,5,Japan,"5,500","5,540","5,660","5,660","5,780"
Nissin,Chow Mein Pad Thai,Tray,United States,3,USA,"4,280","4,080","4,100","4,130","4,400"
Asia Gold,Instant Noodles With Chicken Flavouring,Pack,Hungary,3.5,Hungary,20,20,30,30,30
Nissin,Kuroma-yu Tonkotsu Kumamoto Ramen,Bowl,Japan,4.75,Japan,"5,500","5,540","5,660","5,660","5,780"
Prima Taste,Singapore Curry Wholegrain La Mian,Pack,Singapore,5,Singapore,130,130,130,130,130
Vifon,Chicken Flavour Asian Style Instant Noodles,Pack,Vietnam,3.5,Viet Nam,"5,000","4,800","4,920","5,060","5,200"
Pirkka,Nuudeli Kana Nudlar Kyckling,Pack,Finland,3.5,Finland,10,10,10,10,10
Bonasia,Instant Noodles Duck Flavour,Pack,Hungary,3,Hungary,20,20,30,30,30
Higashimaru,Tonkotsu Ramen,Pack,Japan,4.5,Japan,"5,500","5,540","5,660","5,660","5,780"
MAMA,Seafood Tom Yum Sichek Flavour,Pack,Myanmar,5,Myanmar,410,460,570,590,600
Prima,Juzz's Mee Original Spicy Flavour,Pack,Singapore,5,Singapore,130,130,130,130,130
Ibumie,Always Mi Goreng Perisa Kari Kapitan,Pack,Malaysia,5,Malaysia,"1,340","1,370","1,390","1,310","1,370"
Koh Thai,Island Of Flavours Thai Royal Shrimp Instant Noodles,Pack,Netherlands,1.5,Netherlands,20,20,20,30,20
Master Kong,Spicy Fish Noodle,Bowl,China/Hong Kong,3,China/Hong Kong,"44,400","40,430","38,520","38,970","40,250"
Nissin,Cup Noodle Massaman Curry,Cup,Japan,3.5,Japan,"5,500","5,540","5,660","5,660","5,780"
Asia Gold,Instant Noodles Duck Flavour,Pack,Hungary,3.5,Hungary,20,20,30,30,30
Maruchan,Seimen Houjyun Koku Shoyu,Bowl,Japan,5,Japan,"5,500","5,540","5,660","5,660","5,780"
MAMA,Rangers Snack Noodles BBQ Flavour,Pack,Myanmar,2.75,Myanmar,410,460,570,590,600
Nissin,Cup Noodle Sio,Cup,Japan,5,Japan,"5,500","5,540","5,660","5,660","5,780"
Ottogi,Cheese Ramen,Pack,South Korea,4,Republic of Korea,"3,590","3,650","3,830","3,740","3,820"
Nissin,Cup Noodles Homestyle Chicken,Cup,United States,3.5,USA,"4,280","4,080","4,100","4,130","4,400"
Kuriki,Beef Tongue Shio Mayo Ramen,Pack,Japan,4.5,Japan,"5,500","5,540","5,660","5,660","5,780"
MAMA,Rangers Snack Noodles Sour Cream Flavour,Pack,Myanmar,2.75,Myanmar,410,460,570,590,600
Nissin,Cup Noodles Kyushu White Flavour,Cup,Singapore,3.5,Singapore,130,130,130,130,130
Myojo,Mee Poh Dry,Pack,Singapore,4.25,Singapore,130,130,130,130,130
Myojo,Chicken Abalone Flavour,Bowl,Singapore,3.75,Singapore,130,130,130,130,130
Myojo,Ramen Char Mee 100,Pack,Singapore,3,Singapore,130,130,130,130,130
Myojo,La Ramen Spicy Mushroom Flavour Big Bowl,Bowl,Singapore,4.5,Singapore,130,130,130,130,130
Myojo,Mee Goreng,Pack,Singapore,4,Singapore,130,130,130,130,130
Myojo,La Ramen Spicy Lobster Hot Pot Flavour Big Bowl,Bowl,Singapore,4.75,Singapore,130,130,130,130,130
Myojo,Chicken Abalone Flavour,Pack,Singapore,3.5,Singapore,130,130,130,130,130
Myojo,Thai Tom Yam Flavour,Bowl,Singapore,3.75,Singapore,130,130,130,130,130
Myojo,Chicken Tanmen Flavour,Pack,Singapore,3.5,Singapore,130,130,130,130,130
Myojo,Extra Spicy Singapore Curry Big Bowl,Bowl,Singapore,5,Singapore,130,130,130,130,130
Myojo,La Ramen Spicy Mushroom Flavour,Pack,Singapore,4.5,Singapore,130,130,130,130,130
Myojo,Chicken Flavour,Pack,Singapore,3.75,Singapore,130,130,130,130,130
Sapporo Ichiban,Tonkotsu Ramen Artificially Flavored Tonkotsu White Chicken Broth,Pack,United States,5,USA,"4,280","4,080","4,100","4,130","4,400"
Ibumie,Always Mi Goreng Perisa Thai Tom Yam,Pack,Malaysia,2.5,Malaysia,"1,340","1,370","1,390","1,310","1,370"
Vedan,Wei Wei A Instant Noodles Chicken Flavor,Bowl,Taiwan,0,Taiwan,710,680,770,820,830
Itsuki,Hakata Ossyoi,Pack,Japan,5,Japan,"5,500","5,540","5,660","5,660","5,780"
Nissin,Cup Noodles Minced Pork Flavour,Cup,Thailand,3.75,Thailand,"3,070","3,070","3,360","3,390","3,460"
Asia Gold,Instant Noodles With Beef Flavouring,Pack,Hungary,2.75,Hungary,20,20,30,30,30
Nissin,Soba Fried Noodles Chili,Pack,Germany,3.5,Germany,180,190,200,200,200
Marutai,Kuroma-yu Tonkotsu Kumamoto Ramen,Bowl,Japan,4,Japan,"5,500","5,540","5,660","5,660","5,780"
Yum Yum,Premier Bowl Instant Noodles Stewed Pork Flavour,Bowl,Thailand,4,Thailand,"3,070","3,070","3,360","3,390","3,460"
MyKuali,Penang Spicy Prawn Soup Noodle,Pack,Malaysia,5,Malaysia,"1,340","1,370","1,390","1,310","1,370"
Mama,Shrimp Tom Yum Flavour Cup Noodles,Cup,Myanmar,3.5,Myanmar,410,460,570,590,600
Nissin,Raoh Ramen Noodle Soup Umami Tonkotsu Flavor,Pack,United States,5,USA,"4,280","4,080","4,100","4,130","4,400"
Baijia,Broad Noodle Pickled Vegetable Artificial Beef Flavor,Pack,China/Hong Kong,0,China/Hong Kong,"44,400","40,430","38,520","38,970","40,250"
Ibumie,Always Mi Goreng Perisa Asli,Pack,Malaysia,3.75,Malaysia,"1,340","1,370","1,390","1,310","1,370"
Conimex,Oriental Noodles Groene Curry,Cup,Netherlands,0.5,Netherlands,20,20,20,30,20
Nissin,Cupo Noodle Pasta Style Vongole,Cup,Japan,2.75,Japan,"5,500","5,540","5,660","5,660","5,780"
Mama,Instant Noodles chicken Green Curry Flavour,Pack,Cambodia,5,Cambodia,250,270,280,330,330
Myojo,Wantan Men,Bowl,Japan,5,Japan,"5,500","5,540","5,660","5,660","5,780"
IbuRamen,Mi Goreng Bento Noodles In A Box Shallot Teriyaki Flavor,Tray,United States,3.25,USA,"4,280","4,080","4,100","4,130","4,400"
Indomie,Instant Cup Noodles Mi Goreng Fried Noodles,Cup,Indonesia,5,Indonesia,"13,430","13,200","13,010","12,620","12,540"
Daraz,Negi Man Ramen,Pack,Japan,3,Japan,"5,500","5,540","5,660","5,660","5,780"
Mama,Chinese Kitchen Chinese Style Instant Noodles,Pack,Myanmar,3.5,Myanmar,410,460,570,590,600
Bonasia,Instant Noodles Shrimp Flavour,Pack,Hungary,3.5,Hungary,20,20,30,30,30
Myojo,Udon Japanese Style Precooked Noodles With Soup Hot & Spicy Flavor,Bowl,United States,3.25,USA,"4,280","4,080","4,100","4,130","4,400"
Fujiwara,Snow Crab Flavour Shio Ramen,Pack,Japan,3.5,Japan,"5,500","5,540","5,660","5,660","5,780"
Nissin,Raoh Ramen Noodle Soup Umami Miso Flavor,Pack,United States,4.5,USA,"4,280","4,080","4,100","4,130","4,400"
Pama,Instant Rice Vermicelli Clear Soup Flavour,Pack,Malaysia,3.5,Malaysia,"1,340","1,370","1,390","1,310","1,370"
MyKuali,Penang Red tom Yum Goong Noodle (New Version),Pack,Malaysia,5,Malaysia,"1,340","1,370","1,390","1,310","1,370"
Conimex,Oriental Noodles Hot & Spicy,Pack,Netherlands,3,Netherlands,20,20,20,30,20
Nissin,Chow Mein Savory Sauce And Restayrant Quality Noodles Roast Chicken Flavor ,Tray,United States,4.5,USA,"4,280","4,080","4,100","4,130","4,400"
Mama,Oriental Style Instant Noodles Shrimp Flavour,Pack,Bangladesh,3.25,Bangladesh,250,270,290,350,310
Seven & I,Gold Sumire Ramen,Bowl,Japan,5,Japan,"5,500","5,540","5,660","5,660","5,780"
Forest Noodles,Sunbaked Noodles With Sesame Sauce,Pack,Taiwan,4.5,Taiwan,710,680,770,820,830
Forest Noodles,Purple Sweet Potato Noodles With Taiwanese Sauce,Pack,Taiwan,5,Taiwan,710,680,770,820,830
